"date","flagged","title","source","url","summary","claim","reach_signal","myth_angle","verify_verdict","verify_reason"
"2026-07-15","YES","An Inventor of Apple's FaceID Wants to Analyze Your Brain's Health With AI","Wired","https://www.wired.com/story/the-apple-faceid-veteran-building-a-frontier-ai-model-for-the-human-brain/","Gidi Littwin's new AI startup, Hemispheric, makes diagnostic brain scans for conditions like depression, PTSD, and Parkinson’s. He wants the technology to be as cheap and easy as a blood test.","Analyze Your Brain's Health With AI","Wired front page","The claim that AI can accurately analyze brain health is likely overstated due to the complexity of the brain and the limitations of current AI technology, and more research is needed to fully understand its capabilities and limitations.","KEEP","The snippets show that while AI has potential in healthcare, its capabilities are often overhyped, and there is a need to separate fact from fiction, indicating that the claim of analyzing brain health with AI may be exaggerated and requires more rigorous testing and validation."
"2026-07-15","YES","PsiQuantum has a plan to make a massive quantum computer out of light","MIT Tech Review","https://www.technologyreview.com/2026/07/14/1140356/psiquantum-plan-massive-quantum-computer-out-of-light/","The machine that could change the world will be housed in a room that looks like a data center crossed with an ice cream factory. Inside will be some 100 stainless-steel cabinets, each about six feet tall and connected to a supply of liquid helium that keeps them only a few degrees above absolute zero.…","make a massive quantum computer out of light","MIT Tech Review front page","The claim that PsiQuantum can make a massive, practical quantum computer out of light may be overstated due to the significant technical and engineering challenges involved in scaling up quantum computing technology.","KEEP","The snippets show that while PsiQuantum has a plan to build a massive quantum computer using light, there are concerns and uncertainties about the feasibility and practicality of such a project, as hinted at by DARPA's cautious approach and expert questions about the value of urgent investment."
"2026-07-15","YES","The Motorola Edge 70 Max is all about power","The Verge","https://www.theverge.com/tech/965884/motorola-edge-70-max-qi2-wireless-price-availability","Motorola has launched the Edge 70 Max, its latest flagship phone that's designed for power intensive tasks like streaming video and mobile gaming. Alongside having a huge battery and rapid wired charging support, the Motorola Edge 70 Max is the first Android phone to support full 25W wireless Qi2 charging since Google launched the Pixel […]","the first","The Verge front page","Is the Motorola Edge 70 Max really the first phone in its category to feature magnetic wireless charging?","KEEP","The snippets show that Motorola claims the Edge 70 Max has a feature that is a first for its category, but there is no confirmation from other sources that this is indeed the case, suggesting the claim may be exaggerated or unverified."
"2026-07-15","YES","Anthropic, Blackstone bet the next trillion-dollar AI business is implementation, not just models","TechCrunch","https://techcrunch.com/2026/07/15/anthropic-blackstone-bet-the-next-trillion-dollar-ai-business-is-implementation-not-models/","Anthropic-backed Ode launches as AI labs bet that embedding forward-deployed engineers inside enterprises is the key to accelerating enterprise AI adoption.","the next trillion-dollar AI business","TechCrunch front page","Is the trillion-dollar potential of Anthropic's AI implementation based on realistic expectations, or is it an overestimation of the current capabilities and market demand?","KEEP","The snippets show that while there is significant investment and partnership in Anthropic's AI implementation, some experts and articles suggest that AI is overhyped, indicating that the claim of a trillion-dollar business may be overly optimistic."
"2026-07-15","DROPPED","Samsung’s new foldable display is harder to crease and damage","The Verge","https://www.theverge.com/tech/965850/samsung-display-flex-titanium-galaxy-foldables","Samsung has unveiled a new flexible display technology for foldable phones that's designed to be slimmer, more durable, and less prone to creasing. The Flex Titanium tech is the culmination of everything that the company has learned over seven generations of foldables, according to Samsung, and will debut with the upcoming Galaxy Z Fold 8 […]","harder to crease and damage","The Verge front page","The extent to which Samsung's new foldable display technology is more durable and resistant to creasing may be exaggerated and requires real-world testing.","DROP","The snippets confirm that Samsung has made advancements in reducing creases in their foldable displays, with reports of a creaseless prototype panel and a more malleable optical clear adhesive layer, which suggests the claim is accurate."
"2026-07-15","DROPPED","Rime picks up $24M Series A to help enterprises field customer calls","TechCrunch","https://techcrunch.com/2026/07/15/rime-picks-up-24m-series-a-to-help-enterprises-field-customer-calls/","Rime is handling over 100 million calls each month across multiple companies.","handling over 100 million calls each month","TechCrunch front page","The claim that Rime is handling a large volume of calls may not be entirely accurate or may be taken out of context, requiring further clarification.","DROP","The snippets do not provide any direct evidence to dispute or verify the claim of handling over 100 million calls each month, and the claim is not explicitly mentioned in the provided snippets."
"2026-07-15","NO","Sleep regularity is a stronger predictor of mortality risk than sleep duration (2023)","Hacker News (348 pts)","https://academic.oup.com/sleep/article/47/1/zsad253/7280269","","","HN front page, 348 pts, 157 comments","","",""
"2026-07-15","NO","Jurassic Park computers in excruciating detail","Hacker News (714 pts)","https://fabiensanglard.net/jurrasic_park_computers/index.html","","","HN front page, 714 pts, 177 comments","","",""
"2026-07-15","NO","SpaceX bond worth 10% less than issue price – heading for junk bond status","Hacker News (239 pts)","https://www.ft.com/content/3a023b95-66c3-41e1-b0ce-df752a499541","","","HN front page, 239 pts, 144 comments","","",""
"2026-07-15","NO","Vancouver PD website features Quick Escape button that wipes itself from history","Hacker News (325 pts)","https://vpd.ca/","","","HN front page, 325 pts, 128 comments","","",""
"2026-07-15","NO","TS-2026-009: Insecure argument handling in Tailscale SSH permitted root access","Hacker News (195 pts)","https://tailscale.com/security-bulletins","","","HN front page, 195 pts, 122 comments","","",""
"2026-07-15","NO","Spotify expands parent-managed accounts to users on its free tier","TechCrunch","https://techcrunch.com/2026/07/15/spotify-expands-parent-managed-accounts-to-users-on-its-free-tier/","The feature was previously only available to paid subscribers.","","TechCrunch front page","","",""
"2026-07-15","NO","India bets billions on breaking China’s grip on smartphone manufacturing","TechCrunch","https://techcrunch.com/2026/07/15/india-bets-billions-on-breaking-chinas-grip-on-smartphone-manufacturing/","New Delhi announced a $6.5 billion smartphone manufacturing program and a $13.3 billion semiconductor push to deepen India's electronics supply chain.","","TechCrunch front page","","",""
"2026-07-15","NO","US charges Russian ‘bulletproof’ web hosts over cyberattacks that netted $62M from cybercrime victims","TechCrunch","https://techcrunch.com/2026/07/15/us-charges-russian-bulletproof-web-hosts-over-cyberattacks-that-netted-62m-from-cybercrime-victims/","The 2024 indictment, now unsealed, accuses three Russians and two web hosts of aiding hackers and profiting from cybercrime.","","TechCrunch front page","","",""
"2026-07-15","NO","8BitDo’s FlipPad is the most pocketable way to turn your phone into a Game Boy","The Verge","https://www.theverge.com/tech/964658/8bitdo-flippad-controller-gamepad-smartphone-price-hands-on-availability","Both 8BitDo and GameSir announced tiny gamepads designed to turn smartphones into Game Boy-inspired handhelds at CES 2026. GameSir released its Pocket Taco months ago, but the longer wait for 8BitDo's FlipPad has been well worth it. While the Pocket Taco may be a better fit for some players and devices, the FlipPad is a […]","","The Verge front page","","",""
"2026-07-15","NO","The tiniest MMO","The Verge","https://www.theverge.com/entertainment/965621/playdate-mmo-pointlessquest","At its peak, around 12 million people subscribed to World of Warcraft so that they could explore the realm of Azeroth together. The audience for PointlessQuest is quite a bit smaller. On launch day, the game hit a peak of 15 concurrent players… and no, that sentence isn't missing a word. Then again, basically everything […]","","The Verge front page","","",""
"2026-07-15","NO","Home Depot’s viral 12-foot skeleton now talks","The Verge","https://www.theverge.com/tech/964051/home-depot-halloween-skelly-skeleton-12-foot-mobile-app-sounds","The Home Depot is once again upgrading its 12-foot-tall skeleton to help keep the viral piece of Halloween decor popular as spooky season creeps closer. Skelly is borrowing some of the tech introduced in the smaller 6.5-foot Ultra Skelly last year, including letting you speak through the skeleton's moving mouth using a mobile app. The […]","","The Verge front page","","",""
"2026-07-15","NO","A most improbable astronaut just went to space","Ars Technica","https://arstechnica.com/space/2026/07/a-most-improbable-astronaut-just-went-to-space/","""I pretty much, at that point in time, gave up on being an astronaut.""","","Ars Technica front page","","",""
"2026-07-15","NO","How hard is it to build orbital data centers, actually?","Ars Technica","https://arstechnica.com/space/2026/07/how-hard-is-it-to-build-orbital-data-centers-actually/","""The ISS radiators are expensive and heavy. We're focused on making them cheap and light.""","","Ars Technica front page","","",""
"2026-07-15","NO","Sotheby's big T. rex auction raises concerns hype and wealth are upending science","Ars Technica","https://arstechnica.com/science/2026/07/sothebys-big-t-rex-auction-raises-concerns-hype-and-wealth-are-upending-science/","Private buyers are increasingly outbidding museums for fossils.","","Ars Technica front page","","",""
"2026-07-15","NO","Microsoft’s Secure Boot has been broken for a decade and no one noticed until now","Ars Technica","https://arstechnica.com/security/2026/07/microsoft-secure-boot-has-been-broken-for-most-of-its-existence/","Old and forgotten ""shims"" Microsoft failed to revoke have made Secure Boot bypasses simple.","","Ars Technica front page","","",""
"2026-07-15","NO","Trump admin puts Americans in Congo on ""do-not-board"" list, barring return","Ars Technica","https://arstechnica.com/health/2026/07/americans-in-congo-barred-from-returning-home-amid-ebola-outbreak/","Citizens must now spend 21 days in a third country before they are allowed to come home.","","Ars Technica front page","","",""
"2026-07-15","NO","The Best iPad to Buy (and Some to Avoid) in 2026: Air, Pro, Mini","Wired","https://www.wired.com/gallery/the-best-ipad/","Apple just raised its prices. Here’s an updated breakdown of the brand’s tablets to find the best one for your needs.","","Wired front page","","",""
"2026-07-15","NO","MSI Claw 8 EX AI+ Review: Great Power, Shocking Price","Wired","https://www.wired.com/review/msi-claw-8-ex-ai/","But with great power comes a great price.","","Wired front page","","",""
"2026-07-15","NO","4 Best Personal Safety Alarms: Garmin, Sabre, & More (2026)","Wired","https://www.wired.com/gallery/the-best-personal-safety-alarms-and-gadgets-for-every-situation/","Make some noise for safety with our favorite alarms, from keychain sirens to wearable bracelets.","","Wired front page","","",""
"2026-07-15","NO","The Best Google Home Speaker (2026)","Wired","https://www.wired.com/story/best-google-home-speaker/","There’s now only one worth buying—but you can still access new features on older models you might already own.","","Wired front page","","",""
"2026-07-15","NO","Hinge users can now get friends to hype them up on their profiles","Engadget","https://www.engadget.com/2215630/hinge-users-can-now-get-friends-to-hype-them-up-on-their-profiles/","You can hear about a prospective match from the people who know them best.","","Engadget front page","","",""
"2026-07-15","NO","Apple Intelligence finally gets regulatory approval in China","Engadget","https://www.engadget.com/2215606/apple-intelligence-finally-gets-regulatory-approval-in-china/","Apple will reportedly partner with Chinese firms Baidu and Alibaba to roll out its AI service in the country.","","Engadget front page","","",""
"2026-07-15","NO","iOS 27 preview: Long-awaited Siri AI is practical but plain","Engadget","https://www.engadget.com/2215572/apple-ios-27-preview/","With the iOS 27 public beta available to download, is it worth testing the waters?","","Engadget front page","","",""
"2026-07-15","NO","What the leaf icon on Google Maps really means (and why it confuses so many users)","Engadget","https://www.engadget.com/2209466/what-the-little-leaf-symbol-on-google-maps-means/","Eco-friendly routes on Google Maps are worth checking out, but there are a few things to know before you do.","","Engadget front page","","",""
"2026-07-15","NO","XGIMI Elfin Flip 4K review: An ultra-portable laser projector with sharp video quality","Engadget","https://www.engadget.com/2210501/xgimi-elfin-flip-4k-review/","XGIMI's Eflin Flip 4K is a portable, stylish projector that provides outstanding image quality at a great price.","","Engadget front page","","",""
"2026-07-15","NO","The Download: a useful quantum machine and a record-breaking subsea tunnel","MIT Tech Review","https://www.technologyreview.com/2026/07/15/1140498/the-download-useful-quantum-computer-subsea-tunnel/","This is today’s edition of The Download, our weekday newsletter that provides a daily dose of what’s going on in the world of technology. PsiQuantum has a plan to make a massive quantum computer out of light The machine that could change the world will be housed in a room that looks like a data…","","MIT Tech Review front page","","",""
"2026-07-15","NO","The Download: Claude’s inner workings, and the future of world models","MIT Tech Review","https://www.technologyreview.com/2026/07/14/1140391/the-download-anthropic-claude-internal-thoughts-world-models/","This is today’s edition of The Download, our weekday newsletter that provides a daily dose of what’s going on in the world of technology. What Anthropic’s latest AI discovery does—and doesn’t—show —James O’Donnell When Anthropic announced last week that it had found a new window into its models’ “internal thoughts” as they reason through answers,…","","MIT Tech Review front page","","",""
